{
  "$schema": "https://json-schema.org/draft/2020-12/schema",
  "$id": "https://example.invalid/ai-efficiency/operations-decision-lab/input.schema.json",
  "title": "Operations Decision Lab 002-A input",
  "description": "Closed synthetic input for the single-series forecast and supplied-plan feasibility milestone. Cross-record uniqueness, chronology, availability, and namespace checks are also enforced by schema.mjs.",
  "type": "object",
  "additionalProperties": false,
  "required": [
    "schemaVersion",
    "provenance",
    "forecast",
    "resources",
    "demandGroups",
    "plans",
    "policy"
  ],
  "properties": {
    "schemaVersion": { "const": "1.0.0" },
    "provenance": { "$ref": "#/$defs/provenance" },
    "forecast": { "$ref": "#/$defs/forecast" },
    "resources": { "$ref": "#/$defs/resources" },
    "demandGroups": {
      "type": "array",
      "minItems": 1,
      "maxItems": 100,
      "items": { "$ref": "#/$defs/demandGroup" }
    },
    "plans": {
      "type": "array",
      "minItems": 1,
      "maxItems": 25,
      "items": { "$ref": "#/$defs/plan" }
    },
    "policy": { "$ref": "#/$defs/policy" }
  },
  "$defs": {
    "timestamp": {
      "type": "string",
      "pattern": "^\\d{4}-\\d{2}-\\d{2}T\\d{2}:\\d{2}:\\d{2}(?:\\.\\d{1,3})?Z$"
    },
    "date": {
      "type": "string",
      "pattern": "^\\d{4}-\\d{2}-\\d{2}$"
    },
    "version": {
      "type": "string",
      "minLength": 1,
      "maxLength": 64,
      "pattern": "^[a-z][a-z0-9]*(?:[-_][a-z0-9]+)*$"
    },
    "nonnegativeInteger": {
      "type": "integer",
      "minimum": 0,
      "maximum": 1000000000
    },
    "provenance": {
      "type": "object",
      "additionalProperties": false,
      "required": [
        "snapshotTime",
        "targetStart",
        "targetEnd",
        "serviceDate",
        "policyVersion",
        "modelVersion"
      ],
      "properties": {
        "snapshotTime": { "$ref": "#/$defs/timestamp" },
        "targetStart": { "$ref": "#/$defs/timestamp" },
        "targetEnd": { "$ref": "#/$defs/timestamp" },
        "serviceDate": { "$ref": "#/$defs/date" },
        "policyVersion": { "$ref": "#/$defs/version" },
        "modelVersion": { "$ref": "#/$defs/version" }
      }
    },
    "forecast": {
      "type": "object",
      "additionalProperties": false,
      "required": ["entityId", "quantityId", "unit", "seasonLength", "observations"],
      "properties": {
        "entityId": {
          "type": "string",
          "pattern": "^SYNTH-(?:NETWORK|STATION)-\\d{1,6}$"
        },
        "quantityId": { "const": "packages_tendered" },
        "unit": { "const": "packages" },
        "seasonLength": { "const": 7 },
        "observations": {
          "type": "array",
          "minItems": 35,
          "maxItems": 730,
          "items": { "$ref": "#/$defs/observation" }
        }
      }
    },
    "observation": {
      "type": "object",
      "additionalProperties": false,
      "required": ["observationId", "serviceDate", "availableAt", "value"],
      "properties": {
        "observationId": {
          "type": "string",
          "pattern": "^SYNTH-OBS-\\d{1,6}$"
        },
        "serviceDate": { "$ref": "#/$defs/date" },
        "availableAt": { "$ref": "#/$defs/timestamp" },
        "value": { "$ref": "#/$defs/nonnegativeInteger" }
      }
    },
    "resources": {
      "type": "object",
      "additionalProperties": false,
      "required": ["vehicles", "laborShifts"],
      "properties": {
        "vehicles": {
          "type": "array",
          "minItems": 1,
          "maxItems": 100,
          "items": { "$ref": "#/$defs/vehicle" }
        },
        "laborShifts": {
          "type": "array",
          "minItems": 1,
          "maxItems": 100,
          "items": { "$ref": "#/$defs/laborShift" }
        }
      }
    },
    "vehicle": {
      "type": "object",
      "additionalProperties": false,
      "required": [
        "vehicleId",
        "capacityUnits",
        "availableStart",
        "availableEnd",
        "maxRouteMinutes"
      ],
      "properties": {
        "vehicleId": {
          "type": "string",
          "pattern": "^SYNTH-VEHICLE-\\d{1,6}$"
        },
        "capacityUnits": {
          "type": "integer",
          "minimum": 1,
          "maximum": 1000000000
        },
        "availableStart": { "$ref": "#/$defs/timestamp" },
        "availableEnd": { "$ref": "#/$defs/timestamp" },
        "maxRouteMinutes": {
          "type": "integer",
          "minimum": 1,
          "maximum": 1440
        }
      }
    },
    "laborShift": {
      "type": "object",
      "additionalProperties": false,
      "required": ["shiftId", "startTime", "endTime", "maxOnRoadMinutes"],
      "properties": {
        "shiftId": {
          "type": "string",
          "pattern": "^SYNTH-SHIFT-\\d{1,6}$"
        },
        "startTime": { "$ref": "#/$defs/timestamp" },
        "endTime": { "$ref": "#/$defs/timestamp" },
        "maxOnRoadMinutes": {
          "type": "integer",
          "minimum": 1,
          "maximum": 1440
        }
      }
    },
    "demandGroup": {
      "type": "object",
      "additionalProperties": false,
      "required": [
        "demandGroupId",
        "packages",
        "cubeUnits",
        "serviceMinutes",
        "windowStart",
        "windowEnd",
        "required"
      ],
      "properties": {
        "demandGroupId": {
          "type": "string",
          "pattern": "^SYNTH-DEMAND-\\d{1,6}$"
        },
        "packages": { "$ref": "#/$defs/nonnegativeInteger" },
        "cubeUnits": { "$ref": "#/$defs/nonnegativeInteger" },
        "serviceMinutes": {
          "type": "integer",
          "minimum": 0,
          "maximum": 1440
        },
        "windowStart": { "$ref": "#/$defs/timestamp" },
        "windowEnd": { "$ref": "#/$defs/timestamp" },
        "required": { "type": "boolean" }
      }
    },
    "plan": {
      "type": "object",
      "additionalProperties": false,
      "required": ["planId", "planVersion", "snapshotTime", "releaseTime", "routes"],
      "properties": {
        "planId": {
          "type": "string",
          "pattern": "^SYNTH-PLAN-\\d{1,6}$"
        },
        "planVersion": { "$ref": "#/$defs/version" },
        "snapshotTime": { "$ref": "#/$defs/timestamp" },
        "releaseTime": { "$ref": "#/$defs/timestamp" },
        "routes": {
          "type": "array",
          "minItems": 1,
          "maxItems": 100,
          "items": { "$ref": "#/$defs/route" }
        }
      }
    },
    "route": {
      "type": "object",
      "additionalProperties": false,
      "required": ["routeId", "vehicleId", "shiftId", "visits"],
      "properties": {
        "routeId": {
          "type": "string",
          "pattern": "^SYNTH-ROUTE-\\d{1,6}$"
        },
        "vehicleId": {
          "type": "string",
          "pattern": "^SYNTH-VEHICLE-\\d{1,6}$"
        },
        "shiftId": {
          "type": "string",
          "pattern": "^SYNTH-SHIFT-\\d{1,6}$"
        },
        "visits": {
          "type": "array",
          "minItems": 0,
          "maxItems": 100,
          "items": { "$ref": "#/$defs/visit" }
        }
      }
    },
    "visit": {
      "type": "object",
      "additionalProperties": false,
      "required": ["sequence", "demandGroupId", "arrivalTime", "departureTime"],
      "properties": {
        "sequence": { "type": "integer", "minimum": 1, "maximum": 100 },
        "demandGroupId": {
          "type": "string",
          "pattern": "^SYNTH-DEMAND-\\d{1,6}$"
        },
        "arrivalTime": { "$ref": "#/$defs/timestamp" },
        "departureTime": { "$ref": "#/$defs/timestamp" }
      }
    },
    "policy": {
      "type": "object",
      "additionalProperties": false,
      "required": ["earliestReleaseTime"],
      "properties": {
        "earliestReleaseTime": { "$ref": "#/$defs/timestamp" }
      }
    }
  }
}
